text,speaker,talktime_words,math_density,uptake,student_reasoning,focusing_questions
"To spit it back out.  And understand it.  Okay?  So this math lesson went really well.  Tomorrow’s math lesson is going to piggyback off of what we learned today.  We’re going to take this a step further, okay?  So please write your name please on these papers, all of them, and put them in the red folder in your Avid binder, because I’m going to ask you to take this out tomorrow, you’re going to be regurgitating some of this information, as we push for even better understanding. Okay, I’m going to count down.  10, 9, no, no, no, you’re staying where you are, 8, stay where you are, 7, 6, 5, slant when you’re finished so I’ll know, 4, 3, 2, 1.  Okay. We, ladies and gentlemen, we are going to slide on in to Social Studies.  And what unit are we in now?",teacher,145,1,,,0.0
Explorers.,multiple students,1,0,,,
"We, ladies and gentlemen, are learning about the age of…",teacher,10,0,,,0.0
Exploring.,multiple students,1,0,,,
"The age of discovery, or the age of exploration.  We have ten explorers we need to know about.",teacher,18,0,,,0.0
Is Ponce de Leon one of them?,student,7,0,,,
"Ponce de Leon is one of them, yes, ma’am.",teacher,9,0,1.0,,0.0
Christopher Columbus.,student,2,0,,,
"Christopher Columbus.  I know they’re doing biographies, part of their biographies.  Some of the people that they chose to do biographies on, some of them are explorers.  So they’re going to be our resident experts as we learn about these people and what their motivation was to get out and explore, okay? Ladies and gentlemen, I just need to state this.  I’ll wait.  When we learned about the Aztec civilization, we were learning about the Aztecs themselves, and part of learning about the Aztecs, because they go back so far in history, we learned the complete history of the Aztecs, and part of that history involved Hernan…",teacher,107,0,,,0.0
Cortez.,student,1,0,,,
"Cortez.  Now, ladies and gentlemen, we weren’t learning about Hernan Cortez himself, we were learning about his role in the downfall of the Aztecs.  In the age of exploration or the age of discovery, we are going to be learning about Hernan Cortez himself, okay?  We’re also going to learn about Francisco Pizarro himself, because we talked about him in the downfall of the Incas.  Okay?  So I just want to make that clear.",teacher,74,0,,,0.0
