text,speaker,talktime_words,math_density,uptake,student_reasoning,focusing_questions
"The smaller denominator, the larger the slice.  But what about the numerators?  The numerators are what in this case?  The numerators are the same.  So when the numerators are the same, and the denominators are different, the fraction with the smaller denominator will have the largest sized pieces, as you can see here.  This is a fraction with the smaller denominator so the pieces are larger.  This is the fraction with the larger denominator, so the pieces are smaller. Smaller denominator, larger piece; larger denominator, smaller piece. Look at C, please.  C is a little bit challenging: three-fourths or five-sixths.  Student K, how is it going back there at your table?",teacher,111,14,1.0,,0.0
[Inaudible],student,1,0,,,
Really?,teacher,1,0,,,0.0
I did a number line to figure it out.,student,9,1,,0.0,
You did a number line for which one?  C?,teacher,9,1,1.0,,0.0
Yeah.,student,1,0,,,
"Student K and Student V, do me a favor, move to the rug. Student K and Student V, and I want you guys to show each other what you came up with.  Just Student K and Student V. I’m coming back there.  Yep, take your paper with you. What I want you guys to do is because you said you used a number line, he said he was going to, and I want to see if you came up with the exact same thing.  You know why? Because he tried to explain it to people at his table and they didn't understand, and I want to see if he can make sense with you.  So just go on ahead and tell her, or show her, and let her explain her reasoning to you.  Logos, guys, logos.",teacher,136,1,,,0.0
Can we still [inaudible]?,student,4,0,,,
That’s okay.  That’s more than okay. This was A.,teacher,9,0,,,0.0
"How do you explain these?  I get it all, but I don’t know how to explain it in words.",student,19,0,,0.0,
"Okay, when the numerators are the same, right, what did you do with the denominators?  When the numerators are the same and the denominators are different, which one was larger?",teacher,30,4,0.0,,0.0
Two-fifths.,student,1,0,,,
Why was it larger?,teacher,4,0,,,1.0
"Because one-fifth is bigger than one-seventh, so if you color two of…",student,12,0,,1.0,
Because fifths are larger than sevenths?,teacher,6,0,1.0,,1.0
Yes.  So you color two-fifths.,student,5,0,,,
Why are fifths larger than sevenths?,teacher,6,0,0.0,,1.0
Because you share with less people so you have more.,student,10,0,,1.0,
So you did two-fifths and two-sevenths.  When the numerators are the same…,teacher,12,1,0.0,,0.0
I disagree with my table.,student,5,0,,,
You disagree with your table for C?,teacher,7,0,1.0,,0.0
"I’ll just explain.  Three is just like [inaudible].  They both have different denominators, and four is less than six, and if you want to share the cookie with four people, then six would be bigger.",student,35,1,,1.0,
"Yeah, but I see a little slight difference between B and C.  In B, something is the same.  We’ve got the numerators are the same.  In C, neither the numerator nor the denominator is the same.  So are you sure you want to use that reasoning? Okay, so C, ladies and gentlemen.  We’re going to discuss this.  I’m coming around on C, and I’m seeing the same thing.  I’m seeing kind of a stagnation.  What’s a stagnation at tables?  What does that mean, stagnant?  If water is stagnant it’s not what?",teacher,91,3,0.0,,1.0
Moving.,student,1,0,,,
"It’s not moving, yeah.  And we want to push our learning, and right now our learning is kind of stalled, it’s not moving. So we’re going to have a discussion together about C. With the exception of Student K and Student V, who actually were back there using logos.  What’s logos again?",teacher,52,0,,,0.0
Reasoning.,student,1,0,,,
"Reasoning and logic to explain one fraction being larger than the other, why it was the way that was.  So I’m going to ask you to help me out.  What are the two fractions for C?",teacher,36,2,,,0.0
Three-fourths and five-sixths.,student,3,0,,,
"Three-fourths we’re comparing, and what?",teacher,5,0,,,0.0
Five-sixths.,multiple students,1,0,,,
"Five-sixths, okay.  Let me just draw your attention here.  I’ll wait.  With the exception of Student K and Student V, let me just draw your attention here.  I’m just going to wait till I see all eyes.  I notice here that we had something that was similar.  The denominators were similar.  I noticed here we had something that was similar, the numerators were similar. Do I need to make a phone call gentlemen?  Do I need to make a phone call?  Then what should be happening at that table right now?",teacher,91,2,,,0.0
Working.,student,1,0,,,
"No, no, no, where should your attention be focused right now?",teacher,11,0,,,0.0
At the board.,student,3,0,,,
Mm-hmm.  And why do you think your attention should be focused here?,teacher,12,0,,,1.0
Because you’re trying to help us.,student,6,0,,,
"Thank you.  Evidently some of you don’t want that help.  As I was saying.  I noticed that something was similar here. The denominators.  I notice that something is similar here. The numerators.  In C, do I have anything that’s similar?",teacher,40,2,0.0,,0.0
No.,multiple students,1,0,,,
"There is something that’s similar, but it’s not something that’s stated.",teacher,11,0,,,0.0
They’re one away from the whole.,student,6,1,,,
"They’re both one portion away from the whole.  Oh my goodness, so you did notice that.  It’s just something that you can’t readily see because it’s not written.  So three-fourths is how many fourths away from one?",teacher,37,1,1.0,,0.0
One-fourth.,multiple students,1,0,,,
Five-sixths is how many sixths away from one?,teacher,8,0,,,0.0
One.,student,1,0,,,
"One-sixth, yes.  So they do have something similar.  However, it’s not the numerator and it’s not the denominator.  So the numerator is not similar and the denominator is not similar, but they are similar in that they’re both one portion away from one.  This one being a fourth away, this one being a sixth away. Now, I’m going to ask you…  Remember when I said you need to draw a diagram?  I’m going to ask you to diagram this, and I’m going to tell you, draw a number line.  Draw two number lines that are the same exact size.  Or, use one number line and use a different colored pencil to represent fourths than sixths.",teacher,115,7,,,0.0
Fourths and sixths.,student,3,0,,,
"Mm-hmm.  And then, I’m going to give you a couple of minutes and then I’m going to come back and I’m going to ask you what you noticed. Student T, should you be in conversation with him?  Didn’t your tablemate have a discussion with you about this?  So why aren’t you paying attention so that you can understand the argument the next time he brings it up. Go on ahead and draw that number line.  I want you to see with your own two eyes what one-fourth looks like and what one-sixth looks like, because that’s how short they are from reaching a complete whole.  Guys?  Is this how you draw a number line?",teacher,114,3,,,0.0
No.,student,1,0,,,
"So why aren’t we drawing a number line?  Come on, Student C, put your necklace down for me.  You can take it off.  And let’s draw the number line.",teacher,29,2,,,0.0
I did all of mine.,student,5,0,,,
"You did them all?  Oh, you make me so happy.  Aw.  Yeah.  Can you draw a picture for this?  Any picture showing me 11 or 15 or 7 or 16. Mm-hmm?  What have you got?",teacher,35,0,1.0,,0.0
I’m trying to do my work and she keeps dancing around.,student,11,0,,0.0,
"Excuse me, you, my friend, are able to concentrate.  You’re trying to tell me she keeps coming over here and calling your name?",teacher,23,0,1.0,,0.0
"She’s right here doing it. No she’s not, she’s over there.",student,11,0,,0.0,
"But you can choose to ignore that, you’re a big boy.",teacher,11,0,0.0,,0.0
[Inaudible].,student,1,0,,,
"You know why she’s doing that?  Because she’s happy, she understands something, that’s why.  It’s not meant to be distracting, okay?",teacher,21,0,,,0.0
[Inaudible],student,1,0,,,
"Really, you did this one?  Where is it, show it to me.",teacher,12,0,,,0.0
Right here.,student,2,0,,,
"But I said to do a number line.  I just said, draw a number line for C.  I’m sorry sweetie pie.  Draw a number line.  I want you to draw a number line for C because I want you to see the missing component, the missing piece.  Okay.  I’m going to use it to help me to draw a number line on the board.  Yes ma’am?",teacher,66,5,,,0.0
I don’t know how to draw sixths.,student,7,0,,,
"Okay, so I see here you have one-half. If you’re using sixths, what would be a half?",teacher,17,0,1.0,,0.0
Half would be here.,student,4,0,,,
How many pieces do you have to split this into?,teacher,10,0,,,1.0
[Inaudible].,student,1,0,,,
"[Inaudible]. Okay, I’m coming around to look at what you’ve done.",teacher,11,0,,,0.0
Sssshhhhhh!,student,1,0,,,
"You can’t tell him to shush when you were just making noise. It doesn’t work like that.   Don’t disappoint me. So ladies and gentlemen, I’m drawing my number line here.  You know what I think I’m going to make you guys do?  I don’t know what is going on.  Are we falling asleep?  Are we in food coma mode?",teacher,59,1,,,0.0
No.,multiple students,1,0,,,
"You guys act like you’re so tired, like you’re old.  Yeah. You’re acting like you’re older than I am.  I’m the oldest person in the world and I have more energy than you guys. What’s going on?  What’d you guys do, take sleeping pills at lunch or something?  I got up at four today.  I’m up at four every morning.  I’m here by six every morning.  And then I’m here late in the afternoon here.  So how many hours is that that I’m here at work at your disposal?  From six o'clock in the morning until at least six o'clock at night.  How many hours is that?",teacher,107,0,,,0.0
12 hours.,student,2,0,,,
"12 hours.   That’s half the day, yes.  So I’m going to ask you guys, please, please, I don’t know what’s going on, shake it up! We need to wake up our brains, and we need to figure out C.  Because, ladies and gentlemen, we only have 15 more minutes, and I would like to wrap this lesson up in the last 5 minutes.  We’ve got 10 minutes to look at this, 5 minutes to have a discussion abut what we’ve learned.  So here, ladies and gentlemen, is my number line for C. Here’s my number line for C.  Halfway point is about what, here?",teacher,104,2,,,0.0
Yes.,student,1,0,,,
"So this would be one half.  This would be my zero, and what am I putting on this side?",teacher,19,0,,,0.0
One.,multiple students,1,0,,,
"One.  Now, I’m going to do three-fourths at the top and five- sixths at the bottom of the same number line, okay?  So what do I need to do to show fourths on this number line? I need to do halfway between 0 and one half, and what does this represent?",teacher,51,2,,,0.0
One-fourth.,student,1,0,,,
"One-fourth.  And then what do I need to do?  The same thing between one-half and one, and what does that represent? Student D, put it away please.  So I’ve got one-fourth, what is this?",teacher,34,0,,,0.0
Two-fourths.,student,1,0,,,
Two-fourths.  Three-fourths.  And what would one be?,teacher,7,0,,,0.0
Four-fourths.,multiple students,1,0,,,
"Okay, so ladies and gentlemen, you can see the missing piece here, three-fourths, to four-fourths, one.  So right now, if we were looking at this fraction in a linear way, it would be from zero all the way to three-fourths, okay?  So we’re talking from here, all the way to here.  Now, let’s break this into sixths so we can look at five-sixths on the same number line.  How do I need to break this into sixths? What do I need to do?  What do I need to do, Student N?",teacher,91,3,,,0.0
Break each half into thirds.,student,5,0,,,
"Break each half into thirds, I love your terminology.  So this half needs to have three slices, and then this half needs to have three slices, and all those slices need to be equal.  So from here to here, three equal slices.  That’s about it, right?  So this would be one-sixth, two-sixths, and this would be what?",teacher,57,0,1.0,,0.0
Three-sixths.,student,1,0,,,
"And then I need to do the same thing here, three equal slices. Four-sixths, five-sixths.  Ladies and gentlemen.  Oh wait, what do you notice about five-sixths, which on this number line would go to zero all the way to here?  Student T. Look at that and tell me what you see.  These are fourths, three-fourths.  This is five-sixths.  What do you see? Tell me what you see?",teacher,67,1,,,0.0
I see five-sixths is longer than three-fourths.,student,7,0,,,
"You see five-sixths is longer than three-fourths.  What about this missing piece?  What is missing here between five, six, and the one?  What does this space represent?  One what, Student M?  One-sixth.  What about this space between three-fourths and four-fourths?",teacher,40,0,1.0,,1.0
One-fourth.,student,1,0,,,
One-fourth.  So what do we see here?  This missing piece as opposed to this missing piece?  Five-sixths is definitely what?,teacher,20,0,,,0.0
Larger.,multiple students,1,0,,,
Larger than…,teacher,2,0,,,0.0
Three-fourths.,multiple students,1,0,,,
What rule can we come up with?  Can we come up with a rule? What rule?,teacher,16,0,,,0.0
"You know how like five-sixths, one more sixth…",student,8,0,,1.0,
"Freeze.  Let’s not disrespect him.  Unfreeze.  Do I know how, you were saying?",teacher,13,0,0.0,,0.0
"So three-fourths, you need one more fourth to get to four- fourths.  Five-sixths, you need one more sixth to get to six-sixths.  If you take away one-sixth it’s not going to be this much.  If you take away a fourth it’s going to be like this much.  So if it’s bigger, you know if one-fourth is bigger than one-sixth, so it takes away more.",student,64,0,,1.0,
"It takes away more.  Okay, so, Student E, and correct me if I’m wrong.  Student E is looking at the point of view from if I’m standing at one, if I’m standing at one and I take away a fourth, because fourths are larger, it’s going to take away more.  If I’m standing at one and I take away a sixth, it’s not going to take away as much.  So looking at it from this perspective, because fourths are larger than sixths, if you’re missing a fourth, you’re missing a lot more than if you’re missing a sixth.  So what rule?  Somebody tell me a rule! What rule can we come up with that will fit every single fraction that is missing one portion to be one whole?  What rule can you tell me?  Student B?",teacher,136,2,1.0,,0.0
"That five-sixths, if you do one-sixth…",student,6,0,,,
"But, sweetie, this is what I want.  I want you to tell me a rule that would work for every single fraction that we compare that’s missing one.  So I want you to do the same with something like this, nine-tenths and let’s say eight- ninths.  How far away from one I this?",teacher,53,2,0.0,,0.0
One-ninth.,student,1,0,,,
How far away from one is this?,teacher,7,0,,,0.0
[One-tenth.],student,1,1,,,
"This is one-tenth, this is one-ninth away.  If I have something like this, 55/56, and let’s say 33/34ths.  You should be able to tell me which one is larger and why.  Tell me, how can I take a rule and apply that rule to every single comparison of fractions that I’m doing that’s missing one portion to be a whole.  What rule can I come up with?  What rule?  Student V?  Student K?  Have you guys come up with a rule?",teacher,81,3,,,0.0
For every one of those?,student,5,0,,,
"For any fractions that I’m comparing that’s one portion away from one.  So I’m comparing here ninths and tenths.  This is one-tenth away from one.  This is one-ninth away from one.  What rule can I come up with that will fit this and this and this and any other fraction.  Let’s say I was doing 15/16th and let’s say I was doing 14/15ths.  Or let’s say 12/13ths and 13/14th.  Or let’s say I was doing… Understand what I’m saying?  I need a rule that’s going to fit every single comparison of fractions that I do that each one is only one portion away from being a full hole. So this is missing a 13th.  This is missing a 14th.  What rule can I apply to this, and this, and this that’s the same rule?  A rule I can come up with that will match every single one of these fractions that fit this rule?  Student M?",teacher,156,6,1.0,,0.0
"When the denominator is bigger that means the piece is smaller, and the one piece that’s smaller is the bigger one.",student,21,1,,1.0,
"Okay, so she is so on the right track, I’m getting chills over here.  But guess what, we have to use clearer and …",teacher,24,0,0.0,,0.0
Concise.,multiple students,1,0,,,
More concise language.  She’s on the right track.  So how can we help Student M out?  What can we say?   Student E?,teacher,22,0,,,0.0
"If both fractions are missing a portion, whatever denominator is bigger is going to take more space, subtract more space.",student,20,3,,1.0,
"The rule is, whenever both fractions…  So, when both fractions… Hold on a second, I’m going to ask you one more time.  But that away please, put it all away, thank you. When both fractions are missing one – and I’m saying portion.  Do we know what we mean when we say portion?",teacher,53,3,1.0,,0.0
A portion means one more fraction away.,student,7,1,,,
A portion is a fraction.  But it’s missing what?,teacher,9,1,1.0,,0.0
I thought you meant a portion was a certain amount of something.,student,12,0,,0.0,
"So if a fraction is missing one portion, as if three-fourths is missing a fourth, five-sixths is missing a sixth, so for the time being ladies and gentlemen, we know what we mean when we say portion.  We’re going to have to come back and make this more clear and concise so anybody who walks in will understand, okay?  But for now, when both fractions are missing a portion, a portion from being whole, from being one, right?  One-whole.  When both fractions are missing one portion from being one-whole, so this is missing a portion that keeps it from being four-fourths, this is missing a portion that keeps it from being six- sixths. Okay, what’s the rest of this?  When both fractions are missing one portion from being whole…",teacher,129,8,1.0,,0.0
If the denominator is…,student,4,1,,,
The fraction with…,teacher,3,1,,,0.0
The biggest denominator.,student,3,1,,,
The larger denominator…,teacher,3,1,,,0.0
It takes away more space.,student,5,0,,,
"So the larger the denominator, the larger the fraction?",teacher,9,2,0.0,,1.0
The less amount it takes space.,student,6,0,,,
"So, what?  It’s closer to one is what we’re saying.  The fraction with the larger denominator is closer to one, thereby a larger fraction?",teacher,24,3,0.0,,1.0
Let’s not say [inaudible].,student,4,0,,,
"Is larger because it is closer to one whole.  Let’s read that and make sure it makes sense.  Student J, read that for me, this rule.",teacher,26,1,,,0.0
When both fractions…,student,3,1,,,
Hold on one second.  We need to stop fidgeting.  Nice and loud please.,teacher,13,0,,,0.0
"When both fractions are missing one portion from being one whole, the fraction with the larger denominator is larger because it is closer to one-whole.",student,25,5,,1.0,
Does that make sense?,teacher,4,0,0.0,,0.0
Yes.,multiple students,1,0,,,
"So you can look at that and see that it makes sense?  Thank you Student M, thank you Student E, thank you Student D.  And I will say right now, Student K gave me chills earlier because he was at his table trying to explain it to his tablemates and they just weren’t there.  I think they needed to see it, they needed to push to see it.  And Student V was all over that too. Ladies and gentlemen, I know that we are still learning and acquiring the language of math….   I’ll wait.  When we speak the same language, it’s easy to understand each other, right? Right?",teacher,108,0,,,0.0
Yes.,multiple students,1,0,,,
If you’re speaking English you can understand me.  What happens if you start speaking a language I don’t know?,teacher,19,0,,,0.0
You don’t understand.,student,3,0,,,
I don’t understand.  So in math…,teacher,6,0,,,0.0
You understand what they’re trying to teach.,student,7,0,,,
"In math, part of what we’re seeking is to have a common language.  That common language is the math terms that we use, okay?  And I know we’re still acquiring those math terms, but we’ve got to be able to say larger, bigger, smaller, what?",teacher,45,0,1.0,,0.0
Larger.,student,1,0,,,
"Smaller than, larger than, what other words can we use.",teacher,10,0,,,0.0
Same.,student,1,0,,,
"Same, equal.  What about that top number on the fraction?",teacher,10,1,,,1.0
Numerator.,multiple students,1,1,,,
Num-er-at-or.  And the bottom number?,teacher,5,0,,,0.0
Denominator.,multiple students,1,1,,,
"De-nom-in-at-or.  Okay.  So as we explore and learn, we need to start using the language we’re exploring and learning.  And I put up here, as I came around, each table told me this rule.  Each table, they told me this rule.  Four tables told me this rule.  But when I went around and checked the other two tables, I saw that they had this rule written. Okay, so we explored this rule and we came to it together. And we noticed that they do have something in common, even though our eyes don’t see it.  But when we put it out this way, we can see the commonality that these two fractions have, and that is that they’re one portion away from being whole.  Your job, ladies and gentlemen, as math explorers and investigators, is to pay attention to what you see, whether it’s clear or not, and things you discover, we want to know.  You need to share those things, those ideas, because it’s through sharing of ideas that we learn.  Table one, table three. I want to know, is there anybody in here who did not understand any of this today?  Anybody who did not understand anything we did today?  You’re telling me you didn’t understand any of this?",teacher,211,2,,,0.0
[Inaudible] C.,student,2,0,,,
"C, okay.  And what part of C?  Can you tell me where you lost your understanding?",teacher,16,0,,,0.0
Because I was going to say…,student,6,0,,,
Can you tell me where you lost your understanding?  So you do understand what three-fourths is.  And you do understand what five-sixths is.,teacher,23,0,0.0,,0.0
Mm-hmm.,student,1,0,,,
Yes or no?,teacher,3,0,,,0.0
Yes.,student,1,0,,,
And you do understand how to represent three-fourths and five- sixths on the number line.  And what were we trying to do with these two fractions?,teacher,26,2,,,0.0
Try to see which one was bigger.,student,7,0,,,
We’re determining which fraction was the larger fraction.  And can you see on this number line which fraction is the larger fraction?,teacher,22,5,1.0,,0.0
Mm-hmm.,student,1,0,,,
And why is five-sixths the larger fraction?,teacher,7,1,,,1.0
Because it’s close to one whole?,student,6,1,,,
"It’s closer than three-fourths is. Ladies and gentlemen, when we looked back at this one, we said for this, when the numerators are the same and the fraction with the smaller denominator is larger, but that only applies when the numerator is the same.  Here the one with the smaller denominator was not larger.  Why was this larger again, Student A?",teacher,61,5,1.0,,1.0
Because it’s closer to one whole.,student,6,1,,,
Because it’s closer to one whole than three-fourths.  Is there anybody in here who cannot do fractions on a number line? Is there anybody in here who did not know how to break down a number line?  Okay.  So this is what I’m going to ask you to do.  Remember we talked about what’s a repertoire?,teacher,56,4,1.0,,0.0
Yes.,multiple students,1,0,,,
"And we talked about we have a toolbox and sometimes we have to pull out the toolbox and ruffle through the toolbox to figure out what strategy we’re going to use?  “Oh, yes, I have this strategy, I’ll put that in my back pocket.  I have this strategy, I’m going to put that in this pocket. I have that strategy, I’m going to put that in this pocket. I have this strategy, I’m going to put this in this pocket.” Ladies and gentlemen, every time you learn a new strategy, what do you think I’m going to expect you to do?",teacher,101,0,,,0.0
Remember it.,student,2,0,,,
Use that strategy.  We do the math and then we go back and we do what with it?  We double-check.  And what do I expect you to double-check using?,teacher,29,0,,,0.0
Your notes?,student,2,0,,,
"Right, but if I …",teacher,5,0,,,0.0
Our knowledge.,student,2,0,,,
"A different strategy.  Yeah, a different strategy.  And yeah, you are using your knowledge.  Remember, I’m telling you constantly, what am I always telling you?  You know more than…",teacher,29,0,,,0.0
You think you do.,multiple students,4,0,,,
"You know more than you think you do, yeah.  You do.  Ladies and gentlemen, it’s just trying to get you to articulate what you know, and not be afraid to say what you know.  Okay? Yes ma’am?",teacher,37,0,,,0.0
[Inaudible] regurgitate.,student,2,0,,,
"Regurgitate, yes.  I want you to be able to regurgitate this information.  What does that mean?",teacher,16,0,,,1.0
To spit it out.,student,4,0,,,
