text,speaker,talktime_words,math_density,uptake,student_reasoning,focusing_questions
"Okay.  All righty, so nobody has read this book Spaghetti and Meatballs?",teacher,12,0,,,0.0
No.,multiple students,1,0,,,
"For real?  Student J, you read it?",teacher,7,0,,,0.0
I think it's like a large family or something.,student,9,0,,0.0,
Okay.  Do you remember what the theme was kind of?,teacher,10,0,0.0,,0.0
Like a family reunion.,student,4,0,,,
"Yes, very good!  There was a family reunion.  Okay.  Mr. and Mrs. C wanted to have a family reunion.  Who can tell us what a reunion is?  Student S.",teacher,29,0,,,0.0
Like when a whole bunch of family comes over and you like cook and play games.,student,16,1,,0.0,
"Good.  You can have friends as well at a reunion.  Usually people have a reunion if they haven't seen everybody all together for a while. So the Comforts, Mr. and Mrs. C, they decide to have a family reunion.  There are 32 people coming over, so they wanna make sure they have enough seating for all 32 people.  Now Mrs. C thinks she has a great idea.  She has a way that she has the seating all arranged and when we read it, you're gonna see what happens when more people come over, what they wanna do, which I really can't blame them. Now the theme of this, we're gonna talk about area and parameter. Who can tell me what parameter is?  What is parameter? Student A.",teacher,127,1,1.0,,0.0
The outside of something – shape.,student,6,0,,,
The outside of a shape.  Good.  Who else can tell me another definition?  That's perfect.  Who else?  Anybody else? Student H.,teacher,21,0,1.0,,1.0
"Like if you wanted to walk around like the whole park and you wanted to know how many inches it is, you would go around the park.",student,27,1,,0.0,
"Okay, good.  Student N.",teacher,4,0,0.0,,0.0
It's around the outside of a truck.,student,7,0,,,
What is it?  It's around.  What are we talking about?  It begins with a D.  What are we measuring?  It begins with a D.  We're measuring the what?,teacher,28,2,1.0,,0.0
Difference.,student,1,0,,,
Not the difference.  We're talking about units of length.,teacher,9,2,,,0.0
Diameter.,student,1,0,,,
No.  Now you guessed.  Student J.,teacher,6,0,,,0.0
Dimension.,student,1,1,,,
"No.  If I walked a mile, okay, we're talking about how far I traveled.  What's another word for that?  It begins with a D.  The second letter is an I.",teacher,30,0,,,0.0
"Oh, I know it.",student,4,0,,,
"Yes, Student V.",teacher,3,0,,,0.0
Diameter.,student,1,0,,,
No.,teacher,1,0,,,0.0
Distance.,student,1,1,,,
"Oh, there we go, that's a girl.  We're talking about the distance around an object, okay.  The second part of this objective is after we read it, we're gonna show two other ways Mrs. C could have arranged the seats for the family reunion and then we're going to identify the area and the parameter for each table arrangement. So first thing we talked about was the parameter.  The parameter is the distance around a figure.  Let's take a look at this figure right here.  Does anybody know what shape that is? Student M.",teacher,94,3,,,1.0
Pentagon.,student,1,1,,,
"Pentagon, good.  Now this isn't a scale, I just put numbers there.  Who can tell me the parameter of that pentagon? Who can tell me the parameter?  And remember, look at what it is.  Student A.",teacher,36,3,,,0.0
Fifteen.,student,1,0,,,
Fifteen what?,teacher,2,0,,,0.0
Fifteen inches.,student,2,0,,,
"That a boy, fifteen inches.  Good.  Now, who could tell me the parameter of this shape if each side is one inch?  If each side is one inch – I didn't put any numbers there on purpose.  I'm gonna tell you it's one inch.  Switch it in black.  What's the parameter there?  What's the parameter there with one inch?  Student V.",teacher,61,0,,,0.0
Eight inches.,student,2,0,,,
"Very good.  This would be eight inches.  So all a parameter is, it's the distance around the shape, okay.  So that would be eight inches.  So if I was a little ant and I walked around this shape if [Inaudible] truly were one inch, then I would have walked eight inches. The second part of our objective is we also have to find the area. What's the area?  Look at the word Student W, we have a picture there.  If parameter is the distance around the shape – Student K.",teacher,90,4,,,0.0
Inside the shape.,student,3,0,,,
"Okay.  We're talking about inside the shape, okay.  And area's the number of square units needed to cover a figure.  The units used to measure area are based on units of length, but they are very different.  For example, if this was a one-inch square, the parameter would be four inches.  We're talking about a square, so the area for this square would be one square inch, okay, and we can write that by saying inch with a two above it, inch square.  Okay. The parameter of this square is one centimeter – one centimeter on each side – so the total parameter would be four centimeters.  The area we're talking about, that's a mistake.  The area is what?  One?",teacher,120,21,,,0.0
Centimeter.,student,1,1,,,
You've gotta say square 'cause we're –,teacher,7,1,,,0.0
Square centimeter..,student,2,2,,,
"Square centimeter.  Good, okay, all right.  So I'm gonna start reading this.  What I'm reading – and I found with the other class that I read it through the first time, and then we went back and we talked about some of the arrangements that Mrs. C made for the other people were doing to her four tables is what made her was so upset.  I might stop.  And I picked out a couple of arrangements that people made.  I might stop, then we might do it together. I think you'll find it easier to visualize.  Yes, Student A.",teacher,99,2,,,0.0
Can you put the book on the projector so we can see the pages?,student,14,0,,0.0,
"That's what I planned on doing.  Thank you, Student A.",teacher,10,0,0.0,,0.0
What's that thing over there?,student,5,0,,,
This is a microphone.,teacher,4,0,1.0,,0.0
"Oh, so they can hear what you're singing?",student,8,0,,0.0,
"Yes, they wanna hear me sing.  Like what is it –",teacher,11,0,1.0,,0.0
Sing?  Oh.  You're gonna sing tonight?,multiple students,6,0,,,
No.,teacher,1,0,0.0,,0.0
Tomorrow.,student,1,0,,,
"I'm not singing.  There will be no singing. [Crosstalk]  Okay. Spaghetti and Meatballs. One fine day, Mrs. C was busy tending the lettuce patch in your garden.  ""You know, it's been a long time since we've seen the family,"" she said to her husband.  ""You're right,"" answered Mr. C.  He was stretched out on a bench doing what he liked to do best with a vegetable garden, reading a cookbook. ""Maybe it's time for a family reunion,"" Mrs. C said.  ""A wonderful idea,"" Mr. C agreed.  ""Hmm, let's see. Menus, menus, ends with a two, starts with a six, banquets. How many people would we be having?"" [Inaudible] So there's Mr. C [Inaudible].  There's Mrs. C, lovely couple, working in their garden.  He's reading, she's working.  Ah, one of my favorite things, sitting down.  Oh, yeah.",teacher,136,0,,,0.0
[Laughter],multiple students,1,0,,,
"The Comforts called their children, they called their parents. Mrs. C called their brother, Mr. C called the next door neighbors who were almost like them.  Everyone could come.  ""That's 32 people all together, including us,"" Mr. C said.  ""What could possibly fit in our oven and still feed 32 people?"" he wondered out loud. ""Why not make your famous spaghetti and meatballs?"" asked Mrs. C.  ""Good thinking,"" said Mr. C.  ""Now what about renting some tables and chairs?"" asked Mrs. C. She got out the telephone book.  Yes.",teacher,89,0,,,0.0
[Inaudible].,student,1,0,,,
Okay.,teacher,1,0,,,0.0
"That was like those three bears that's like Goldilocks, the Queen's chair.  The medium chair and the small chair.",student,19,0,,0.0,
"That's a nice connection.  Two weeks later – that's a [Inaudible].  Two weeks later, the big day arrived.  Mr. C got up very early and spent all morning cooking. He baked 16 loaves of garlic bread and made 8 pounds of fresh pasta.  He simmered 8 quarts of spaghetti sauce and rolled 96 meatballs. Mrs. C picked all her ripe tomatoes, cucumbers, and lettuce for a salad, while Mr. C waited for the tables and chairs she had rented while Mrs. C [Inaudible].  She grew a seeding plant.  Then she got out the dishes, the silverware, the glasses, the table cloths, and some vases. When the rental company arrived, they were one chair short. ""Don't worry,"" said Mrs. C, ""we'll think of something."" So if you were one chair short, just curious, what would you do? Real life situation, real world problem.  What would you do?  Student A.",teacher,148,2,1.0,,0.0
I'd get another chair from the house.,student,7,0,,,
"Yeah, there you go, perfect.  Mrs. C found a folding chair.  Good job Student A. Now the tables were ready.  Each had four place settings, four chairs, and a vase with lovely cut flowers.  Mr. C came out of the kitchen balancing eight plates of [Inaudible] – one for each table.  So how did she arrange the chairs?  How did she arrange the chairs?  Student S.",teacher,66,0,1.0,,1.0
Four.,student,1,0,,,
By fours.  Correct.  So she arranged the chairs by fours.  How many tables were there?,teacher,15,0,,,0.0
Eight tables.,student,2,0,,,
Eight tables.,teacher,2,0,,,0.0
Eight times four is thirty-two.,student,5,0,,,
Say it again.,teacher,3,0,0.0,,0.0
Eight times for is thirty-two.,student,5,0,,,
"So can we all agree that there's thirty-two chairs, because eight tables times four chairs with total of thirty-two chairs.  Good?",teacher,21,1,1.0,,0.0
Yeah.,multiple students,1,0,,,
You feel good about that?,teacher,5,0,,,0.0
Yes.,multiple students,1,0,,,
"Okay, good.  Just after noon, the Comfort's daughter and her husband arrived with their two children.  ""Welcome,"" said Mrs. C.  ""Come sit,"" said Mr. C.  ""Let's push two tables together so you can sit with us,"" suggested the Comfort's daughter.  ""But there won't be room,"" Mrs. C said.  ""But there is,"" said Mr. C.  ""There's plenty of room and plenty of garlic bread."" I think he's not really understanding what she's saying.  She's saying there won't be room, but he's saying there will be. Why won't there be room?  Why won't there be room?  Student C.",teacher,96,0,,,0.0
Because they weren't one of the thirty-two people.,student,8,0,,1.0,
They what?,teacher,2,0,1.0,,0.0
They weren't one of the thirty-two people.,student,7,0,,,
"No, they were part of the thirty-two people.  And why combine it?  Those two tables are gonna mess everything up.  Why is that?  Student J.",teacher,25,0,1.0,,1.0
Because they're one chair short out of a table.,student,9,0,,1.0,
"It would be one chair short out of a table, okay.",teacher,11,0,1.0,,0.0
Because two people won't be able to sit there.,student,9,0,,1.0,
Two people won't be able to sit.  So you say two people won't be able to sit and you say one person won't person won't be able to sit.,teacher,29,0,1.0,,0.0
I say two.,student,3,0,,,
"Why don't we do this.  Why don't we figure this one out for right now.  Why don't we take out – and Student K, you can just move your chair over there at any desk.  Student M, you can just turn around right there.  I want everybody on your desk, in your groups you will find colored tiles.  I want everybody to take out eight, you'll only need eight. [Crosstalk]",teacher,70,0,,,0.0
"I got mine all in red.  Mine are all in red.  I know, all right.",multiple students,15,0,,0.0,
"It doesn't matter what color they are. [Crosstalk] You only need eight Student S.  Only eight.  Very good. [Crosstalk/0:13:47] Okay, good.  Every has out eight.  Focus!  Student J, eight, that's it.  That's all you need to grab, just eight.  Okay, now, how did they want – so people came over and they wanted – turn your whole desk around. They wanted – they came over and they wanted since they were the only ones there, okay – her daughter came over their daughter came over with her husband and their two kids.  They're the only ones there at the time, so they're like, ""You know what, nobody really likes to eat alone,"" so they wanted to eat with the Comforts and Mr. C wanted to eat with them.  So they said, ""You know what, let's combine two tables.""  So everybody combine two tables just like this. [Crosstalk] Go ahead and do another arrangement.  Now, if they combined two tables, what would be the number of chairs that could fit around all of these tables now?  There's still eight tables, but what could be the total number of chairs that could fit around there?  Now remember that each spot, that would be a chair, that would be a chair, that would be a chair, that would be a chair, that would be a chair, and right there. How many chairs could they fit now?  Go ahead, look at it.  Turn around all those chairs.  Now how many chairs fit around one table everybody?",teacher,252,2,1.0,,0.0
Eight.  Four.,multiple students,2,0,,,
How many chairs fit around one table?,teacher,7,0,,,0.0
Six.  Four.,multiple students,2,0,,,
How many chairs fit around one table?,teacher,7,0,,,0.0
Four!,multiple students,1,0,,,
"Okay, [Inaudible] one table.  How many chairs would fit around there now?  Student C.",teacher,14,0,,,0.0
Six.,student,1,0,,,
Six where?,teacher,2,0,,,0.0
[Inaudible],student,1,0,,,
"So you're saying six would fit here, and you are correct.  Six would fit here, but Student C, I want you to then combine that six with these right here.  Now we know that four can fit around these.  So I guess what I'm asking you Christian is, ""What is the total number of chairs that could fit around all eight tables?""",teacher,62,1,,,0.0
One then four.,student,3,0,,,
"Well, let's take a look here.  How many tables are here?",teacher,11,0,,,0.0
Six.,student,1,0,,,
"There's six tables.  How many chairs at each table.  Four, good.  And what's six times four?",teacher,16,0,,,0.0
Twenty-four.,student,1,0,,,
"So we have twenty-four chairs here Student C, plus we have another six.  So how many total chairs do we have now?",teacher,22,1,,,0.0
Thirty.,student,1,0,,,
"Thirty.  So if everybody showed up right now, guess what?  How many chairs short would they be?",teacher,17,0,,,0.0
Two.,multiple students,1,0,,,
They would be short two chairs.  Did the amount of tables change?,teacher,12,0,,,0.0
No.,multiple students,1,0,,,
"No, the amount of tables didn't change.  Changed were the number of the way they arranged it.  So by arranging them a certain way, that changed the amount of chairs.  Yes, Student K.",teacher,33,0,,,0.0
"I did it in my [book report], by putting my –",student,11,0,,0.0,
"Oh, you're doing something different.  We're not there yet. Don't, don't – you're getting ahead of me.  Okay.  Put those back quickly.  That way, I don't wanna hear any tiles when I'm leaving. [Crosstalk/0:18:23] Five, four, three, two, one.  Okay.  Okay, so we know that isn't gonna work, so let's take a look it again.  Everyone was just about to sit down when a cop pulled into the driveway. And Mrs. C's brother and his wife and daughter, her husband and [Inaudible] son all spilled in.  ""Welcome,"" said Mr. C.  ""Sit down, sit down.""  ""Oh, let's push over two more tables so we can all sit together,"" said Mrs. C's brother's wife. The Comforts daughter and her husband got up to help.  But that won't work.  So look what they wanted to do now.  What did they wanna do now?  What did they wanna do now?  Student M.",teacher,148,0,0.0,,0.0
They wanted to put four tables together.,student,7,0,,,
They wanted to put four tables together.  How many people think that's gonna work?,teacher,14,0,1.0,,0.0
I don't know.,student,3,0,,,
"No?  How many people say it's not gonna work?  How many people are just not sure?  Okay, thank you for being honest. We're gonna come back to that – this one. ""You're so right,"" Mr. C said.  We have to put two more tables together.  ""But that won't work either,"" said Mrs. C. ""You're right,"" said Mrs. C's brother Dwight.  ""Make way,"" shouted Mrs. C's brother and the Comforts son- in-law.  They each carried over a table and put them side by side. ""You don't understand,"" Mrs. C sighed.  ""My plan was,"" but no one heard her.  Everyone was too busy.  Everybody's moving stuff, they're having a good time, they're hugging each other, right?  ""Save some of the garlic bread for me,"" the new arrival called.  ""Me too, me too, me too,"" three more voices piped in. ""Well look who's here,"" said Mrs. C's brother's daughter's husband.  It was the Comforts next door neighbors with their daughter and son.  ""Hello, hello,"" said Mr. C, ""so glad to see you.  Have a seat and I'll get the garlic bread.  ""But there's no place for them to sit,"" said Mrs. C. Yeah, they are right.  This guy, he's excited.  He's got a camera out and stuff.  ""Don't worry,"" said Mrs. C's brother's wife, ""we'll just divide these tables into two groups of four."" How many people think that would work?  You have – okay, Student L, this is what you do with your notebook.  You put four tiles here and four tiles there.  How many people think that would work, if they had two groups of four?  How many? Sound pretty good, right?  Okay, we'll come back to that one. ""Go ahead,"" Mrs. C said.  ""But I'm telling you, you fret too much,"" said Mr. C.  ""Bread anyone?"" So there's two sets of four there, two sets of four there, and as you're doing it, everybody's moving plates.  It's just getting crazy.  When all the tables had been rearranged, everyone sat down. ""See mom,"" the Comforts daughter said, ""it worked out just fine."" Mrs. C sighed.  It's like Mrs. C knows something that the other people don't.  How many people still think two groups of four will work? Okay, you know what?  Let's try that.  Everybody take [their] tiles again.  Lay two groups of four. [Crosstalk/0:21:58] Two groups of four.  If you don't know how to make it, look up at the board. Two groups of – Student D, you don't need [Inaudible] You know, you can kind of estimate how many tiles you need.  You have about 20 tiles on your desk.  Student A, we're not building tile towers.  No, you may not.  [Crosstalk] Remember, think about parameter, the distance around an object. Think about parameter, the distance around an object.  Love what you're doing Student C.  [Crosstalk] Do you have it? Do you have it? Student G, you feel confident?",teacher,480,4,,,0.0
No.,student,1,0,,,
"Student J, look at the board and look at yours.  There you go, that a girl.  Okay, now remember, think of where those chairs can fit.  Now, if it helps you, okay, just count all right.  I know here, one chair, two, third one, fourth, five, six, seven, eight. Okay, so some people said no.  I mean some people thought that they could fit thirty-two chairs there.  So who honestly – raise your hand if you thought thirty-two chairs could fit in that room.  That's okay.  I'll move it for you. Okay, Student J, how many chairs can fit there in that arrangement the way it is?",teacher,107,0,,,0.0
"There can be two on this side, two on this side, two on the back, and two on the side.",student,20,0,,0.0,
"Okay, so one arrangement can have how many?  How many chairs?",teacher,11,0,1.0,,0.0
Eight.,student,1,0,,,
"Eight.  That a girl.  So one arrangement can fit here, the other arrangement, it's the same shape, how many can that fit Student S?",teacher,24,0,,,0.0
Two.,student,1,0,,,
That a girl.  What's the total chairs for both of those shapes? Combine them.  How many do we have?  Student L.,teacher,21,1,,,0.0
I [went] sixteen.,student,3,0,,,
"Amazing Student L.  It's like I called on you – you must be ventriloquist or something, because I thought I heard somebody's voice without their mouth moving.  Hmm, I wonder what he said.  Who said that out loud –",teacher,39,0,,,1.0
Eight plus eight is seventeen.,student,5,0,,,
"Who said sixteen when I called on her?  I don't know, interesting.  Thank you Student J.",teacher,16,0,0.0,,0.0
Sixteen.,student,1,0,,,
"Eight plus eight is sixteen.  So actually there's less chairs here in this arrangement than the second one they did. Yes, Student T.",teacher,23,0,,,0.0
That's half of thirty-two.,student,4,0,,,
"That's half of thirty-two, very good.  Okay, keep your tiles the way they are, just don't touch them.  I don't wanna hear – I hear – okay, let me erase this. Okay, when all the tables have been rearranged, everyone sat down. See how the Comfort's daughter said it worked out just fine. ""Hi ya, hi ya, hi ya,"" boomed a familiar voice!  Sounds like my grandfather.  Mr. C's father, mother, and their little terrier strolled in.  ""Hello grandma, hello grandpa,"" the Comfort's daughter shouted. ""Oh, dear,"" said Mrs. C.  ""You think they could sit,"" because you just have that visual now, right?  That's the way they arranged the tables.  Now there's only sixteen. ""No problem,"" said Mrs. C's next door neighbor.  ""If we just push all eight tables into one long line, then there will room enough for everyone."" Oh, yeah.  That makes a lot of sense, right?  Have a nice long line?",teacher,154,2,,,0.0
No.,multiple students,1,0,,,
No?,teacher,1,0,,,0.0
No.  Yes.  No.,multiple students,3,0,,,
Yeah?,teacher,1,0,,,0.0
No.,multiple students,1,0,,,
"How many people say yes?  Ah, yeah.  Come on, let's do it.  Do it right now.  Make one long line and figure out how many people can fit there.  I think this is a good idea. [Crosstalk] One long line Student J.  Take all these – yeah, there you go, that a girl.  [Crosstalk]  One long line, eight tiles.[Crosstalk/0:27:15] I don't care about the snow, okay.  It's nothing that you haven't seen before.  All right, [Clapping hands] so how many people can be arranged the way it's set up now?  Somebody we haven't heard.  Student M.",teacher,96,3,,,0.0
What?,student,1,0,,,
How many people the way it's set up now could sit at these tables now?,teacher,15,0,,,0.0
Eighteen.,student,1,0,,,
Eighteen.  Is that gonna work?,teacher,5,0,,,0.0
Yes.  No.,multiple students,2,0,,,
"No.  A good idea though when you think about it, just one straight line.  What's the problem though?  What do they need more of in order for this way to work?  Student M.",teacher,33,1,,,0.0
More tables.,student,2,0,,,
"Excellent.  They need more tables in order for that to work. Yeah, I know their food is good enough for them.",teacher,21,0,,,0.0
[Laughter],multiple students,1,0,,,
"It would be good for us.  Yes, Student A.",teacher,9,0,,,0.0
"When you put them together, they're supposed to be one chair in here and here.  But basically [Inaudible]",student,18,0,,0.0,
"Exactly, very good, excellent.  Okay Student K, take that. [Crosstalk] Oh, but they're all having so much fun.  The cats and dogs like [Inaudible].  See that right there? [Laughter] Everybody can go .  Uh-oh, look at these two things. No sooner had everybody gotten settled, the Mrs. C's mother and father drove up in their yellow convertible.  ""Hello grammy, hello gramp,"" the Comfort's daughter shouted. Mrs. C put down her fork.  ""Oh, dear,"" she said.  ""So far we're all family, right,"" grandpa said.  ""Let's just split this long line of tables in two so there'll be plenty of room for us to squeeze.""  But it still isn't going to work because Mrs. C started to say a bowl of salad slipped into her lap.  ""Sorry,"" said one of Mrs. C's brother's daughter's twin sons.",teacher,134,2,1.0,,0.0
"Oh, my God.",student,3,0,,,
"Mr. and Mrs. C and their eighteen relatives and neighbors were finally all seated.  They passed the salad and the bread, they shared the celery and the olives, and when they heard a cheery, ""Hi, everyone,"" most of them held onto their plates.  The Comfort's son and his wife peddled in on a bicycle for two.  They're twin daughters rolled in on skates. ""Didn't I tell you,"" Mrs. C said, ""there's not enough room."" ""No problem mom,"" said the Comfort's son.  We'll just divide those lines of tables into four tables.  And there she is.  It looks like she's got a major headache right now. ""Wait, wait, you're all forgetting something,"" said Mrs. C. ""We're out of salad over here,"" the Comfort's daughter said.  ""Don't put any tomatoes in mine,"" said the Comfort's next door neighbor's son.  ""Is there more garlic bread?"" asked Mrs. C's mother.  ""Who's got more silverware?"" asked Mr. C's father. ""Hey,"" Mrs. C's brother's daughter's son had said to his twin brother, ""that's my bread you're eating.""  ""Get your fingers out of my salad,"" the Comfort's son's daughter said to her twin sister.  ""Don't play with you food,"" said the Comfort's son's wife.  ""What did you say?"" asked Mr. C.  ""I said, things are getting a little out of hand now."" Beep, beep.  Big Red's red van parked at the curb.  Out jumped – we're being good listeners that I shouldn't see anybody with those tiles. Out jumped Mrs. C's sister with their husband and their triplets.  All three of the triplets had brought their boyfriends who were also triplets.  ""Now do you see what I mean?"" Mrs. C asked.  ""Where are they all going to sit?"" ""Well my dearest,"" said Mr. C, ""I haven't served the spaghetti yet.  We'll just move a few chairs, reset a few places, and there will be plenty of room for everyone."" ""I give up,"" cried Mrs. C.  She sat down in her chair and didn't budge.  ""I'd say we divide the full [panels of] tables into eight single tables,"" Mrs. C's brother said. He and his wife moved on pair of tables apart, the triplets and their boyfriends moved the other three pairs.  ""You see,"" said Mr. C, ""it all worked out.""  ""I see everything is back exactly the way I had it!"" said Mrs. C.  ""I knew you'd think of something,"" said Mr. C.  Now how many meatballs were served? So what happened at the end of this story?  What happened?  Hands please, hands.  Student J.",teacher,418,3,,,0.0
It ended back [Inaudible],student,4,0,,,
