text,speaker,talktime_words,math_density,uptake,student_reasoning,focusing_questions
"Nine tenths.  Could you place that for me please?  Okay.  So I know that one is equivalent to ten tenths, so nine tenths would be just to the left of that.  It would be one less. Student J, do you want to do the last one for us please? Seven tenths.  Good.  Okay.  Nice job.  I know a few of those are difficult, but some of you weren't sure, and you asked for help from me or someone else, and some of you were good enough to go around once you finished.  So let's look with comparing and ordering decimals.  When would I ever do that?  Okay.  So I think you'll like the first thing that comes up.  I know I kind of laughed a little bit when it came up last night.  McDonald's menu.  I'm lovin' it. [Laughter]  So remember, a lot of these websites are created by other teachers, so which – let's just look at a few of these items, okay?  I have my double cheeseburger. I have my Big Mac value meal.  So I have my McFlurry. Let's say I'm not sure if I want an ice cream cone, or a McFlurry.  Which one costs more?  Can you explain why to me, Student R?",teacher,208,7,,,0.0
You said—,student,2,0,,,
"I'm not sure if I want an ice cream cone, or if I want a McFlurry.  How do I know which one costs more?  Can you explain?",teacher,27,0,,,1.0
I think the McFlurry's more because it's $1.97.,student,8,0,,1.0,
"It's $1.97, and the ice cream cone is—",teacher,8,0,1.0,,0.0
Only 87 cents.,student,3,0,,,
"87 cents, so the ice cream cone has – there's no number to the left of that decimal point, is there?  There's no whole, so it's a little bit under a dollar.  Okay.  Did you have a comment, Student B?",teacher,40,2,,,1.0
"Yeah, but you already said that, because the one is before the decimal, it means there's more than one whole.",student,20,2,,1.0,
"Exactly.  So let's take a look at this one here.  Order up, least expensive, to most expensive.  So if I took all those items, which another day we'll probably do another activity similar to that, if we had more time I would have left that menu up, and I would have had you order them, line them up from least expensive, to most expensive.  So there's my ice cream cone, 87 cents, 99 cents.  I have two items that are the same price, then I go all the way up to my most expensive which is my chicken salad which is $4.80.  Four wholes, and my eighty hundredths, my 80 cents out of a dollar, okay?  What do I mean, compare decimals?  When we compare we use terms such as less than, greater than, or equal to.  Comparing decimals is similar to comparing whole numbers, believe it or not.  45 is less than 47, just as 150 is greater than 105.  When we compare decimals we use place value, or a number line.  What is it, Student M?",teacher,178,9,0.0,,0.0
Can I use the bathroom?,student,5,0,,,
"Yes.  Okay, so remember when we did something like this the other day?  I gave you a number, and then we had our – let's start with our whole before the decimal point.  so my whole numbers would be my ones, my tens, my hundredths, and my thousandths, and when I move to the right of the decimal I have my tenths, my hundredths, my thousandths, and my ten thousandths.  Remember, my thousandths is different than thousands, isn't it?",teacher,79,12,0.0,,0.0
Yes.,multiple students,1,0,,,
Thousands are whole numbers.  Thousandths are not.,teacher,7,3,,,0.0
What is the ten thousands?,student,5,1,,,
"They just didn't go over that part.  They could have done that. They could have done ten thousands.  They could have done one hundred thousands.  They could have done a million, but you have enough, so these are numbers that you would deal with more on a daily basis than you would in the larger numbers, so they didn't feel it was necessary.",teacher,63,3,1.0,,0.0
"When I went to a store, and they had like, the table, and all the money was taped on, I saw a one million dollar bill on it.",student,28,0,,0.0,
"That's impressive.  Okay, so let's look at – we looked at a menu at McDonald's.  Now we're looking at half pipe results.  What's a half pipe?  We all know what a half pipe is, right?",teacher,35,0,1.0,,0.0
No. Yes. What? [Inaudible]. The half pipe's the card.,student,9,0,,0.0,
No.  Wow.  I'm surprised.  You know what?,teacher,7,0,0.0,,0.0
"Oh, I know.",student,3,0,,,
"Student A is in the boy's room, and Student A would know this for sure.  Student B?",teacher,17,0,,,0.0
"Those pipes that are connected to [inaudible], and they go to—",student,11,0,,0.0,
Nope.,teacher,1,0,0.0,,0.0
"Like these big, big pipes, and sometimes skateboard—",student,8,0,,0.0,
"Yes, skateboarders would call it half pipe.  Okay.  So remember the other day we were talking about races, whether someone's running track, whether someone's swimming, and we talked about this time.  What is it?",teacher,34,0,1.0,,0.0
Can I use the bathroom?,student,5,0,,,
"Yes.  So this is very similar to how that was represented the other day.  So I look at the half pipe results, and if I line them up by decimal points, I see their scores.  So if I start at the left, and I find the first place digits differ, and I compare those digits, I see that Sarah's score would be forty-two and one tenth, correct, versus Danny's score is forty-two and five tenths, or forty two and a half, which means Sarah's score was lower than Danny's score, okay?",teacher,91,6,0.0,,0.0
Can I go to the bathroom?,student,6,0,,,
"You'll have to wait until Student A comes back.  So here it is. They're representing it on a number line, okay?  So my forty-two, my whole number, and just like we broke down our number line, Student R, in to tenths, they're doing the same thing right here, forty-two and one tenth versus forty- two and five tenths.  Decimals that name the same number are called equivalent decimals.  Six tenths, sixty hundredths.  Are these the same?",teacher,76,11,1.0,,0.0
Yeah.,student,1,0,,,
"We just did this, didn't we?",teacher,6,0,,,0.0
Yeah.,multiple students,1,0,,,
"We just did this.  Yes they are.  So let's look.  Again, we've used a number line, and we've used the grids, correct? Same representation.  Placing a zero to the right of the last digit in a decimal, although we added a zero, the value of the decimal did not change.  Annexing, or adding a zero is used to [inaudible] decimals.",teacher,60,6,,,0.0
What does annex mean?,student,4,0,,,
Add.,teacher,1,1,,,0.0
Oh.,student,1,0,,,
"Okay.  we can order decimals from least to greatest, or we can order them from greatest to least, so if I order 15, 14 and ninety-five hundredths, 15 and eight tenths, and 15 and one hundredth from least to greatest, it should look something like this.  That's not in order.  That's just showing you the numbers.  Now this one's placed in order.  They're trying to show you.",teacher,67,4,,,0.0
Just add a zero.,student,4,1,,,
That's right.  You add a zero if you want as we're placing them.,teacher,13,1,,,0.0
How is it – can you put it back?,student,9,0,,0.0,
I can't.,teacher,2,0,1.0,,0.0
How does 14 95—,student,4,0,,,
"Right here.  It's not.  They're going from least to greatest, so 14 and ninety-five hundredths is smaller than 15, 15 is smaller than 15 and one hundredth, and 15 and one hundredth is smaller than 15 and eight tenths, which you also know is 15 and eighty hundredths, okay?  So I'm going to start there for now.  What I want to do is just come over to, and do one of these quickly back on Mr. N's website.  He puts the decimals in order from least to greatest by dragging them.  We did this just the other day.  Who wants to come up and try and place the first one?  Student M, go try the first one.",teacher,117,6,,,0.0
Didn't we already do this one?,student,6,0,,,
"Not the same one, and if it is, it's not a big deal.  Okay.  So he said one and four tenths comes first.  Is he correct?",teacher,26,1,0.0,,0.0
No.,student,1,0,,,
Student A?,teacher,2,0,,,0.0
Yes.,student,1,0,,,
Why is it the second one?,teacher,6,0,,,0.0
"Oh yeah, because it's a whole.  It's right there.",student,9,1,,0.0,
Student R?,teacher,2,0,0.0,,0.0
"One and two hundredths. Tenths. Oh yeah, tenths.",student,8,3,,0.0,
"Two tenths?  Can you come up and put it in the right place? You don't need to move his because he left us enough space. See what you missed?  One and two tenths, then one and four tenths.  So what would come next, Student C?  Come up and try one.  Come up.  I can't see completely from there. Just don't go near the camera please.  What?",teacher,66,3,1.0,,0.0
[Inaudible].,student,1,0,,,
Two and four tenths comes next.  Lindsay?,teacher,7,1,,,0.0
She won't scoot over all the way.,student,7,0,,,
"That's fine.  The number line is big enough, so it's not a big deal that they're not exact.  If I wanted them precise, I'd let you know.  So two and four tenths, two and five tenths? Student S?  Three and nine tenths, Student A?  Four and eight tenths, Student A?  Five and one tenth, Student B? Five and seven tenths, Student J?  Six and six tenths, and that leaves what, Student L?  Come up.  Six and eight tenths.",teacher,78,9,0.0,,0.0
Can't they all get closer?,student,5,0,,,
Hmm?,teacher,1,0,0.0,,0.0
I just think they need to get closer.,student,8,0,,0.0,
"No.  Okay, so for right now what I want to do is – did you represent decimals by using the number line?",teacher,22,2,0.0,,0.0
Yes.,multiple students,1,0,,,
"You did more than that.  You represented them.  You represented fractions, and you represented percents.  Did you order the decimals and justify why you put them where you did?",teacher,29,3,,,1.0
Yes.,multiple students,1,0,,,
And their equivalents?  Did everybody meet today's objective?,teacher,8,1,,,0.0
No.,multiple students,1,0,,,
Yes we did.,student,3,0,,,
Yes.,multiple students,1,0,,,
Yes we did.  I would hope so.  Okay.  So we're going to stop there for now.,teacher,16,0,,,0.0
