text,speaker,talktime_words,math_density,uptake,student_reasoning,focusing_questions
"Okay.  We're good.  Before we start our lesson, we're doing our",teacher,11,0,,,0.0
Oh yeah.,student,2,0,,,
"Another one?  How many boxes did you do?  What we have left, we know what to do with.  You guys came up with a lot.  Two more minutes.  We're not going to spend too much time on this.  Okay.  The only difference that we have today when I ask you to come up to the board if you want to share, is if you just use the blue pen or the black pen.  Just when they're photographing the other colors, they don't show up too well, okay?  So let's first – because we did our unit with the fractions, let's start with the fractions first. Is there someone who wants to share an equivalent for a tenth that they wrote in fraction form?  Student R?",teacher,125,6,,,0.0
Two quarters.,student,2,1,,,
Can you go write it please?,teacher,6,0,,,0.0
Up there?,student,2,0,,,
"Mm-hmm.  Just use blue or black, okay?  Anyone else?  Student A, do you want to share?  What did you have?",teacher,20,0,,,1.0
One tenth.,student,2,1,,,
Okay.  Hold on.  I don't know what it's doing.,teacher,9,0,,,0.0
[Inaudible],student,1,0,,,
"Someone already got that.  Does anyone have an equivalent using hundredths?  I need one equivalent with hundredths.  If I have one tenth, how many hundredths would that be?",teacher,28,6,,,1.0
Ten out of a hundred.,student,5,1,,,
So if you looked at your first grid and you actually shaded it in – can I see this please?,teacher,20,0,0.0,,0.0
Mm-hmm.,student,1,0,,,
"You shaded in one tenth.  Over here you also shaded in one tenth, but you also shaded in ten hundredths because you shaded in ten squares out of the hundred squares.  What about thousandths, thousandths?  Student J.",teacher,37,8,,,0.0
One hundred thousandths.,student,3,2,,,
"Could you write that for us please?  So if I have one tenth, I have ten hundredths, I have a hundred thousandths.  Good. What's happening here?  What is happening with those specific equivalents?  Look at those four squares on your paper.  What's happening on mine?",teacher,45,6,,,1.0
You're multiplying by 10.,student,4,1,,,
"Multiplying by 10.  Anyone else?  Student R, is that what you were going to say?",teacher,15,1,,,1.0
Yeah.,student,1,0,,,
Student A?,teacher,2,0,,,0.0
"That, or that goes to [inaudible] to the right.",student,9,0,,0.0,
"Multiplied by 10, okay, and I know some of you had four fortieths, five fiftieths, and so forth, but the main thing I wanted you to see was the tenths, the hundredths, the thousandths, and then I want to try ten thousandths. Student R.  You can just use that bottom space right underneath there.  By one tenth, ten hundredths, one hundred one thousandths, how do I say that one, Student B?",teacher,71,9,0.0,,0.0
One thousand ten – one thousand and ten thousandths.,student,9,3,,0.0,
"One thousand ten thousandths, good job.  Okay.",teacher,7,2,1.0,,0.0
"You could do it ten thousandths, [inaudible].",student,7,1,,,
"Good, definitely could.  That would get more difficult, but as you see, as you go I shade in certain portions.  I get in to those tiny, tiny boxes.  It gets a little more difficult to see, but they're still equivalents, and that's what's important.  So now—",teacher,46,1,1.0,,0.0
How could they [inaudible] all those tiny boxes?,student,8,0,,0.0,
"Now what I want to do is – let's just.  I have to erase.  What? It won't let me erase.  I don't know why.  I'll leave that up there just – oh, now it's disappearing.  Okay.  So you had a lot of equivalents which was great, but before this I want to save these ones for now, because those are the ones you're going to be using the most.  Now who wants to come up and share a way that you wrote it using percents, using percents?  Student A.  That's ten percent, correct?",teacher,93,4,0.0,,0.0
Oh no.,student,2,0,,,
Okay.  What?,teacher,2,0,,,0.0
Never mind.  I just lost it.  [Inaudible].,student,7,0,,,
"So if I look at any of my four gardens, is that percent going to change?",teacher,16,1,0.0,,0.0
No.,multiple students,1,0,,,
"Does it matter whether it's one tenth, ten hundredths, one hundred one thousandths?  It's all equal to ten percent. That's why I had you shade it in so you could see that. Anyone want to share how they wrote it in decimal form? Student J?  No?",teacher,46,6,,,1.0
Ten hundredths?,student,2,1,,,
How did you write it?,teacher,5,0,,,1.0
"Oh, I don't know.  [Inaudible] one tenth.",student,7,1,,,
Want to try it?  Try it.  Let's see how he does.  Let's see if it comes out the same way.,teacher,20,0,0.0,,0.0
Do I just put it in the same one?,student,9,0,,0.0,
Just do it quickly like you're writing in your notebook. That's fine.  That's fine.,teacher,14,0,1.0,,0.0
I did that too.,student,4,0,,,
Okay.  So we can fix this.  Is that one tenth?,teacher,10,1,,,0.0
Yeah.,student,1,0,,,
"Let's just make that decimal point a little bit larger so you can see it.  Try and do that, you know, when we're working on this unit.  Make sure I can see that, okay?  Is that one tenth?  Can you say it a little bit louder?  That's ten hundredths.  It's definitely an equivalent.  Anyone want to try and write it another way for me?",teacher,64,5,,,1.0
"Which one, type – like, this is one the number chart, how tenth all goes down the [inaudible], unless you went with like a hundred, and the most [inaudible]. That's how I wrote it.",student,34,2,,0.0,
"Right, and remember, you don't have to put that zero, but most of the time you will see it written that way.  So I have one tenth, ten hundredths.",teacher,29,2,1.0,,0.0
I've got one.,student,3,0,,,
What?,teacher,1,0,,,0.0
"This is [inaudible] one, and then you have the [inaudible].",student,10,0,,0.0,
That's right.  You can have it.,teacher,6,0,0.0,,0.0
Oh right.,student,2,0,,,
"Just do it.  Just show us.  If it's not right, then we'll get it out.  Can you make that decimal point a little bit larger?  Good.  Put the pen down, then we'll discuss it. Okay.",teacher,35,1,,,0.0
[Inaudible].,student,1,0,,,
"Don’t speak out.  What do we have up there?  What did Student A – I'm glad you did that, Student A, because I'm hoping that not me, one of your classmates, is going to tell you what the difference is of what you just put up there, because we touched on this the other day a little bit.  Student A, what did Student A just put up here?",teacher,68,0,,,0.0
Student A just put a whole.,student,6,1,,,
Student A put one whole.  Can you – which is one hundred percent.  One whole which would be in fraction form over there like that.,teacher,25,5,1.0,,0.0
Ten tenths.,student,2,1,,,
"Ten tenths, one over one, one hundred over one hundred.  Okay, so he gave us one whole.  Can someone explain to him so that he understands the difference in what he put up there, versus these two?  Student B.",teacher,39,4,,,1.0
Because one whole is larger than one tenth?,student,8,2,,1.0,
"One whole is larger than one tenth, or one one-hundredth, but can you explain the representation so that when he sees something written in decimal form, he knows if it's a part of a whole, or if it's a whole?  Who can help him out with that?  Want to try?",teacher,50,6,1.0,,1.0
"Because he put the one before the decimal, and added two zeros.",student,12,1,,1.0,
"Are you paying attention, Student A, to his explanation?  Say that again to him please.",teacher,15,0,1.0,,0.0
The one before the decimal. Oh. Something like that.,student,9,1,,0.0,
Do you remember now what was discussed the other day?  So what does it mean if I have a number on the left hand side of the decimal?  What does that mean?,teacher,32,1,1.0,,1.0
Oh.,student,1,0,,,
"I want to make sure that you have it before we go on.  Student A, can you help explain that?  How do I know which is a whole piece, whole number, and what is a part of that whole?  How do I know?  By looking at this?  By looking here?  By looking here?  Student A, do I have a whole number here?",teacher,62,4,,,1.0
No.,student,1,0,,,
Why?,teacher,1,0,,,1.0
"Because after the decimal, that's where it goes to a part of a whole.",student,14,2,,1.0,
To the right of the decimal tells me it's a part of a whole.,teacher,14,2,1.0,,0.0
"Before the decimal, then add a number.  That means it's a whole.",student,12,3,,0.0,
"Add a number to this side, to the left of the decimal means a whole, and there isn't one.  What about here, Student A? Do I have a whole at all?",teacher,31,4,1.0,,1.0
No.,student,1,0,,,
How do I know that?,teacher,5,0,,,1.0
Because there's no one before the decimal.,student,7,1,,,
"There's nothing on this side of the decimal which means that I only have a piece of a whole.  Okay.  So Student A, do I have a whole here?",teacher,29,3,1.0,,0.0
"Yeah.  No, no.",student,3,0,,,
"Student M, do I have a whole here?",teacher,8,1,,,0.0
Yes.,student,1,0,,,
How do you know I have a whole?,teacher,8,1,,,1.0
Because there's a number before the decimal.,student,7,1,,,
"There's a number before the decimal, to the left of the decimal.  So that means I have one whole, and nothing else because what does the decimal point mean?  It means the word—",teacher,33,4,1.0,,1.0
And.,multiple students,1,0,,,
"And, so this means I have no whole, but I have ten hundredths of a whole.",teacher,16,3,,,0.0
"Oh, so I have to put the one before it?",student,10,0,,0.0,
"After, after.",teacher,2,0,1.0,,0.0
"If it doesn't have nothing before the decimal, you don't have to say and.",student,14,1,,0.0,
Right.  So what then—,teacher,4,0,0.0,,0.0
"Yeah, that's how [inaudible], because I didn't—",student,7,0,,,
"What's the difference of what you put, and what I just changed it to?  What's the difference?",teacher,17,0,0.0,,0.0
"Isn't it the same? I put it in to the whole amount, in tenth.",student,14,2,,0.0,
"Right.  I actually have one hundredth one thousandths, which—",teacher,9,2,0.0,,0.0
Oh.,student,1,0,,,
"These are all clues.  Right.  You had the decimal after the one, making it a whole, okay?  Good.  You sure you have that now?  Good.  Okay.  So now, here's what I want you to do.  You know how Mrs. W. is not great at drawing, but this is what we're going to do.  You have some number lines on the next page.  Is that page 17 I believe?",teacher,68,3,,,0.0
Yes.,multiple students,1,0,,,
"We're going to use those, and I'm going to draw one on the board.",teacher,14,0,,,0.0
Can we put our notebooks away?,student,6,0,,,
"Keep it out for now.  So I start at zero, and I end at two. Well the one that I'm doing, we're going to do something first, then you're going to do something on your next page, okay?  So I have a number line here that begins at zero, and ends at two.  Is two a whole number?",teacher,58,2,0.0,,0.0
Yes.,multiple students,1,0,,,
"Yes, okay?  Not a fraction, not a decimal.  So we've used number lines before.  Now what I want you to do is I'm going to give you – I'll put it over here.  It won’t let me – six tenths.  Please don't put your hands up, even if you have the answer.  Please don’t speak up.  Think about it yourself.  If you're not really sure, and you want to speak to a partner, you can.  Think about where would you place that on that number line?  Where would I place six tenths? Put your hands down for now.  I want everyone to have a chance.  Even if you're not sure, talk to someone if you need a little help.  All right.  Who thinks they know where they would put – I'm not going to have you put it up here right now.  I just want you to share with the class, where would I put six tenths, Student S?",teacher,159,7,,,0.0
It's at the—,student,3,0,,,
Nice and loud.,teacher,3,0,,,0.0
It's to the half point between the zero and the one.,student,11,0,,0.0,
Next to the halfway point between the zero and the one.  Which side of the halfway point would I put it on?,teacher,22,0,1.0,,0.0
The right side?,student,3,0,,,
"The right side, why?",teacher,4,0,,,1.0
Because it's sixty [inaudible].,student,4,0,,,
"It's sixty what?  I said it was six tenths, but it would be 60? Sixty one hundredths, and how do you know that it would go next to the half?  Can anyone be a little more precise in explaining that, more specific?  You're right, but I want just a clearer reason for why I would put it there. Student L?",teacher,60,2,,,1.0
I don't know that the halfway point is fifty percent.,student,10,1,,0.0,
"Hold on.  Okay, so she knows that the halfway point would be fifty percent, which is—",teacher,16,1,1.0,,0.0
A half.,student,2,0,,,
"Which is a half, which is five tenths.  Thank you.  That's what I want.  We're dealing with tenths, so I want to think about it in tenths.  What could I do to my number line to be more specific?  So you know if this is five tenths, you're correct in saying that six tenths goes inside it, but what would be a more specific, or more precise way of demonstrating that in another way?  Student R?",teacher,76,6,,,1.0
Can I use the bathroom?,student,5,0,,,
Yes.  Student S?,teacher,3,0,0.0,,0.0
You could write all the points of the tenth.,student,9,1,,0.0,
"Oh, so I could break this down in to tenths, so I would have one tenth, two tenths, three tenths, four tenths.  My halfway mark, five tenths, six tenths, seven tenths, eight tenths, nine tenths, ten tenths are one whole, okay?  So now I can look at that more clearly, and I can say, yes, six tenths goes there.  I can label each one in tenths. Does everyone see that?",teacher,70,14,1.0,,0.0
Yes.,multiple students,1,0,,,
Do you want to just work on your own?  Okay.  So—,teacher,11,0,,,0.0
[Inaudible].,student,1,0,,,
"No.  We're going to use something else instead of cards.  Okay. So now, before we go to that page, I'm going to put – whoever's doing that, please stop.  Okay.  Someone asked if we're doing cards.  Instead of me passing out all the cards, to save time, I'm going to put the numbers, the decimals that I want you to place, on the board, just to save time, okay?  But for right now, we're still using my number line.  We're not using the number lines in your book.  I'm going to put some more numbers up here, and I want some volunteers to come up and tell me where you would put these, and tell me what they are.  I'm not going to tell you what they are.  Okay.  The first number up there, can you tell me what it is, Student B?  First number that I wrote, what is it?",teacher,151,3,,,0.0
Three tenths.,student,2,1,,,
"Three tenths.  Can you place it on the number line for me please?  You put your hand up too quickly, so that's what happens.  Three tenths, he did the same as I did.  It's a [inaudible] fraction, so it doesn't really matter if we write it in fraction form or decimal form for today.  Don't worry about it, Student B.  The next one, Student R.",teacher,65,6,,,0.0
What's everybody on?,student,3,0,,,
What is it?  What's the next one?  Tell me what it is.,teacher,12,0,,,0.0
Five tenths.,student,2,1,,,
Say it louder please.,teacher,4,0,,,0.0
Five tenths.,student,2,1,,,
"Five tenths.  What are you going to do?  Write it.  Okay. Student R is going to represent it in decimal form, but yes, someone said it's already up there.  That's fine. Just write it right underneath.  Don’t worry about it. Just put it right underneath.  Good.  What's the next one, Student A?",teacher,52,2,,,0.0
One and twenty-five hundredths.,student,4,1,,,
One and twenty-five hundredths.  Is there another way of saying that?,teacher,11,1,,,1.0
One and one fourth.,student,4,0,,,
One and one fourth.  Where would you put that?  Then tell us why.,teacher,13,0,,,1.0
Do I use blue or black?,student,6,0,,,
"Black or blue, it doesn't matter.",teacher,6,0,1.0,,0.0
"I'd probably put it about, like, right here.",student,8,0,,0.0,
"Before you do that, what would be a more specific way of placing that?",teacher,14,0,1.0,,0.0
Why can't we use the red or the green?,student,9,0,,0.0,
"It doesn't show up on the tape recorder, so they asked me to just use the blue and the black.  All right.  So before you place that one, what is a step you can take to make sure you're putting it in the correct place?",teacher,45,0,1.0,,0.0
I could try dividing it by fourths.,student,7,0,,,
All right.  She might divide – when she's looking at the one and going to the two she could divide it in to fourths. What would you do to divide in to fourths?  What would be your first step probably?  What did I do between the zero and the one?,teacher,50,3,1.0,,1.0
[Inaudible].,student,1,0,,,
Before I divide it—,teacher,4,1,,,0.0
Find the halfway point.,student,4,0,,,
"Find the halfway point, good.  Not always going to help you, you know, if you're dealing with thirds or another number, but we're dealing with fourths right now, so she found the halfway mark.  Now how would I know where to put one and twenty-five hundredths?",teacher,46,1,,,0.0
Because that would be another half.,student,6,0,,,
"All right.  She's going to cut that in half again.  You may as well do it on both sides.  That's fine.  Good.  No, don't do both together.  It's either one or the other.  You were doing one and twenty-five hundredths that way, so why don't you just keep it in the decimal form, okay?  Good.  Okay. So what would this be if I wanted to half this, what would be a—",teacher,71,2,1.0,,0.0
[Inaudible].,student,1,0,,,
Hold on.  Who could tell me what this would be?  Student A.,teacher,12,0,,,1.0
One and fifty – one and half.,student,7,0,,,
"One in a half, or one and—",teacher,7,0,1.0,,0.0
Five tenths.,student,2,1,,,
"One and five tenths, one and fifty—",teacher,7,1,,,0.0
Hundredths.,student,1,1,,,
"Hundredths.  So then what would this one be?  If she's dividing that in to fourths, what would it be?",teacher,19,1,,,0.0
Seventy-five.,student,1,0,,,
"Right, one and seventy-five hundredths.  Good.  So then what Student A did was great for hers, but what she did isn't really going to help me for this one.  So what am I going to do?  It will help me a little bit.  Student A, what?",teacher,46,1,,,0.0
"I know that one eighth is half of one fourth, so since we're dealing with a whole, 1.810 is in the middle between one whole, and 1.5.  I mean, one whole, and one twenty-five hundredths.",student,35,4,,1.0,
Is it?  Student B?,teacher,4,0,0.0,,0.0
It—,student,1,0,,,
"Your reasoning is good, but I think you got a little – all right.  Do you know what you did?  Let him – I'd rather he think it through.",teacher,29,0,,,1.0
"It's more than a half.  It's one and 80 – it's one and eight tenths, and it's bigger than one and twenty-five hundredths.",student,23,2,,1.0,
And it's bigger than one and five?,teacher,7,0,1.0,,0.0
Tenths.,student,1,1,,,
"Okay, but I don't have this broken down in to tenths.  I have it broken down in to fourths.  So how can I do this, Student B?",teacher,27,1,,,1.0
"The one in eight tenths has to be between the one seventy-five hundredths, and the two wholes.",student,17,3,,0.0,
"You're right, but if I said to you, I want you to put it in exactly the right place, I want you to be very precise in doing that, how can you do that?",teacher,34,0,0.0,,1.0
You need a ruler?,student,4,1,,,
"Right, but you actually don't need a ruler for this.  What did I do over here?  I broke it down in to tenths, so what did we say this is?",teacher,30,2,,,0.0
Half.,multiple students,1,0,,,
"We said it's – we said that that's actually, if I bring the line—",teacher,14,1,,,0.0
Whoa. I like that.,student,4,0,,,
"So if I bring this line all the way down, it's actually one and five tenths, correct?  So then I need to – then Student A said that right here is one and twenty-five hundredths, so here's my one.  So then I would do – two tenths is a little bit smaller than twenty-five hundredths, correct?  So then three tenths, four tenths, here's my five tenths, six tenths, seven tenths would be a little bit smaller than seventy-five hundredths, correct?  So then my eight tenths would come right after, nine tenths.  I suppose my ten tenths would be one and ten tenths would be my two, correct?  So then would I then place my – is this then the same as this side?  The only difference is that Student A also labeled it in fourths, correct?  We got a little bit messy here just because we didn't have a lot of space, okay?  All right.  So here's what I want you to do.  I want you to take a look at page – is it 17?",teacher,176,15,,,0.0
Yes.,multiple students,1,0,,,
"Okay.  Page 17.  I'm going to put five numbers on the board, and I want you to – you can work with a partner, or if you want to work on your own that's fine.  Instead of passing out the cards, to save time, I'm just going to pick five numbers and put them up here.  You're going to place them on your number line.  Your number line is a little bit different than mine, okay?  So this should be easy.  One tenth, seven tenths, fifteen hundredths, forty-five hundredths, nine tenths.  Can you place them all on one number line?  I want them all on the same number line.  Use number line one.  If you want to work on your own you can. If you want to work with a partner – but I want you to take those five numbers and place them on your number line. Hurry up.  We only have five minutes, then we're going to move on.  Okay.  I'm glad we did that exercise, and I think I magically picked the right numbers.  Can everyone go back to their own seats?",teacher,185,11,,,0.0
It was not easy.,student,4,0,,,
Well that's fine.  You got through it.,teacher,7,0,,,0.0
We should do more harder.,student,5,0,,,
"Oh we will.  Trust me.  Maybe not today, but we will.  Can everyone go back to their own seats please?",teacher,20,0,1.0,,0.0
"I want to do it in 7th grade, or 8th grade.",student,11,0,,0.0,
"Is everybody paying attention?  Okay.  Close enough to what your number line looks like, okay?  So the first number I gave you, and just – I don’t know if it will show up a little bit differently on the camera, but when you come up, would you use the blue just to try and see if it comes out a little bit differently with the two different colors? Would you come up and do one tenth, Student R?  One tenth, then we'll discuss some of the issues that we ran in to. Then once we finish with this activity, I found a pretty nice website the other night that gives a little bit of explanation on ordering decimals on a number line, then we'll go back to Dr. Nussbaum's website, and we'll have him place some numbers.",teacher,137,5,0.0,,0.0
I only have some numbers.,student,5,0,,,
Where am I putting it?  Very good.,teacher,7,0,0.0,,0.0
"Just because we draw, it goes [inaudible].",student,7,0,,,
"I know.  So there's my one tenth.  What was the next number I gave you, Student R?",teacher,17,1,0.0,,0.0
Fifteen hundredths?,student,2,1,,,
"Fifteen hundredths.  Can you place that up there for me?  I'm going to erase.  [Inaudible].  Fifteen hundredths.  Yeah, you can put it up on top.  That's good.  How did you know to put that there, and how did you know you can make your own line?",teacher,46,3,,,1.0
"Because I know that if you divide it in to 10, 15 isn't really in to 10.",student,17,1,,1.0,
Could you explain that?  I got distracted.  Sorry.,teacher,8,0,0.0,,1.0
"I know that this – I know how to make my own line because I know this was divided in to 10 and 15 doesn't go in to 10, but I know that it went there because 10 and 20 would be 15.  That would be like the halfway point.",student,50,2,,1.0,
"Right, but what's an equivalent for one tenth that would help me with fifteen hundredths?  Ten hundredths, and twenty hundredths.  So if I have ten hundredths here and twenty hundredths here, it would make sense that fifteen hundredths falls in between, and she knew that.  She wasn't sure how to explain that, but she knew that.  What was the next one?",teacher,61,8,1.0,,0.0
Forty-five hundredths.,student,2,1,,,
Student B?,teacher,2,0,,,0.0
Forty-five hundredths.,student,2,1,,,
"Forty-five hundredths.  This is the one, the fifteen hundredths.  I noticed the tenths, most of you went just like that, and you placed the tenths, and when you got to fifteen hundredths, and forty-five hundredths, some of you got a little stuck and were not really sure what to do. Student B, can you explain as you're doing that where you're putting it, and why you're placing it there please? It's fine.  It's good enough.  Why are you putting it there, though?",teacher,82,6,,,1.0
Because [inaudible].  I just give them the same one.,student,9,0,,0.0,
Just leave it.  All right.  Why did you put forty-five hundredths there?,teacher,12,1,0.0,,1.0
"Because this is thirty hundredths, and this is fifty hundredths, so it has to be between, forty-five.",student,17,2,,1.0,
"Okay.  So he's saying he put this here because he knew this was four tenths, or forty hundredths, and my halfway mark is here, which is five tenths, or fifty hundredths, so he knew that forty-five hundredths had to come in between.  The last few were a little bit easier.  Student M, what was the next one?",teacher,57,5,1.0,,0.0
Nine tenths.,student,2,1,,,
